,img_id,title,img_url,description,sex,material,price,brand,colour,Description
55,55,MEN Stretch Wool Pants (Set Up),https://d15udtvdbbfasl.cloudfront.net/catalog/product/large_image/08_433339.jpg,added stretch to these pants made of high quality wool a pair that combines beauty with comfort made of high quality super 110s wool good stretch for improved comfort thoughtfully made for a complete look including details such as the sewing thread and needle,MEN,"Shell: 98% Wool, 2% Spandex/ Lining: 100% Polyester",99.9,UNIQLO,Color: COL08 DARK GRAY,added stretch to these pants made of high quality wool a pair that combines beauty with comfort made of high quality super 110s wool good stretch for improved comfort thoughtfully made for a complete look including details such as the sewing thread and needle
56,56,MEN Ultra Light Pants (Cotton Like),https://d15udtvdbbfasl.cloudfront.net/catalog/product/large_image/09_430932.jpg,kando pants has been renamed to ultra light pants these high performance pants were developed with adam scott and feature super fast super stretchy and ultra lightweight functionality brand original material developed jointly with toray carefully designed from a single thread easy care fabric is wrinkle resistant even after washing lightweight and breathable air dots inside the pocket and at the back of the waist add comfort,MEN,100% Polyester,49.9,UNIQLO,Color: COL09 BLACK,kando pants has been renamed to ultra light pants these high performance pants were developed with adam scott and feature super fast super stretchy and ultra lightweight functionality brand original material developed jointly with toray carefully designed from a single thread easy care fabric is wrinkle resistant even after washing lightweight and breathable air dots inside the pocket and at the back of the waist add comfort
57,57,MEN Ultra Light Pants (Wool Like),https://d15udtvdbbfasl.cloudfront.net/catalog/product/large_image/05_430933.jpg,kando pants has been renamed to ultra light pants excellent functionality and incredibly cool and lightweight an elegant feel and a clean look made from brand s unique material that uses a particular thread jointly developed with toray a classy texture that feels like light wool so it is perfect for both formal occasions and business easy care that prevents wrinkles even after washing these high performance pants were developed with adam scott and feature super fast super stretchy and ultra lightweight functionality a perfectly balanced slim fit silhouette featuring a carefully designed bottom width the waist stretches making it very easy to move around in to reduce stress on the hips for when you bend or play golf lightweight and breathable air dots inside the pocket and at the back of the waist add comfort,MEN,100% Polyester,49.9,UNIQLO,Color: COL05 GRAY,kando pants has been renamed to ultra light pants excellent functionality and incredibly cool and lightweight an elegant feel and a clean look made from brand s unique material that uses a particular thread jointly developed with toray a classy texture that feels like light wool so it is perfect for both formal occasions and business easy care that prevents wrinkles even after washing these high performance pants were developed with adam scott and feature super fast super stretchy and ultra lightweight functionality a perfectly balanced slim fit silhouette featuring a carefully designed bottom width the waist stretches making it very easy to move around in to reduce stress on the hips for when you bend or play golf lightweight and breathable air dots inside the pocket and at the back of the waist add comfort
58,58,MEN JWA Wool Blend Flat Front Pants,https://d15udtvdbbfasl.cloudfront.net/catalog/product/large_image/57_435455.jpg,simple and elegant flat front pants comfortable lightweight and elegant new lifewear that combines brands focus on design fit fabric and functionality with jw andersons focus on traditional british apparel into innovative designs made of a wool blend so they are lightweight with a premium feel flat front pants with a center crease an item that embodies the elegance of this collection a simple straight cut that can be dressed up or down,MEN,"Shell: 45% Polyester, 33% Wool, 22% Rayon/ Lining: 100% Polyester",14.9,UNIQLO,Color: COL57 OLIVE,simple and elegant flat front pants comfortable lightweight and elegant new lifewear that combines brands focus on design fit fabric and functionality with jw andersons focus on traditional british apparel into innovative designs made of a wool blend so they are lightweight with a premium feel flat front pants with a center crease an item that embodies the elegance of this collection a simple straight cut that can be dressed up or down
59,59,MEN +J Wool Blend Relax Tapered Pants,https://d15udtvdbbfasl.cloudfront.net/catalog/product/large_image/39_436117.jpg,legendary designer jil sander returns to brand with her signature modernist style inspired by a sense of enlightened understatement the collection consists of exceptional pieces with versatile styling options a comfortable cut that is just loose enough so you can enjoy a trendy relaxed look sturdy wool pants with nylon blended in a refined relaxed tapered fit that you can wear easily,MEN,"Shell: 90% Wool, 10% Nylon/ Lining: 100% Polyester",39.9,UNIQLO,Color: COL39 DARK BROWN,legendary designer jil sander returns to brand with her signature modernist style inspired by a sense of enlightened understatement the collection consists of exceptional pieces with versatile styling options a comfortable cut that is just loose enough so you can enjoy a trendy relaxed look sturdy wool pants with nylon blended in a refined relaxed tapered fit that you can wear easily
60,60,MEN +J Wool Slim Fit Pants (Set Up),https://d15udtvdbbfasl.cloudfront.net/catalog/product/large_image/69_436119.jpg,legendary designer jil sander returns to brand with her signature modernist style inspired by a sense of enlightened understatement the collection consists of exceptional pieces with versatile styling options premium pants using wool developed by a japanese manufacturer packed with details even in the lining used material developed by japan s major wool manufacturer nikke special processing for a tailored premium look a basic fit that is easy to style original logo added on the waist lining,MEN,Shell: 100% Wool/ Lining: 100% Polyester,59.9,UNIQLO,Color: COL69 NAVY,legendary designer jil sander returns to brand with her signature modernist style inspired by a sense of enlightened understatement the collection consists of exceptional pieces with versatile styling options premium pants using wool developed by a japanese manufacturer packed with details even in the lining used material developed by japan s major wool manufacturer nikke special processing for a tailored premium look a basic fit that is easy to style original logo added on the waist lining
61,61,MEN +J Wool Blend Pants (Set Up),https://d15udtvdbbfasl.cloudfront.net/catalog/product/large_image/69_436847.jpg,legendary designer jil sander returns to brand with her signature modernist style inspired by a sense of enlightened understatement the collection consists of exceptional pieces with versatile styling options basic pants that looks great on anyone packed with details even in the lining made of premium wool with a neat crisp feel a basic fit that is easy to style original logo added on the waist lining modern and refined stripes,MEN,"Shell: 50% Wool, 50% Polyester/ Lining: 100% Polyester",39.9,UNIQLO,Color: COL69 NAVY,legendary designer jil sander returns to brand with her signature modernist style inspired by a sense of enlightened understatement the collection consists of exceptional pieces with versatile styling options basic pants that looks great on anyone packed with details even in the lining made of premium wool with a neat crisp feel a basic fit that is easy to style original logo added on the waist lining modern and refined stripes
63,63,MEN Smart Slim Fit Pants,https://d15udtvdbbfasl.cloudfront.net/catalog/product/large_image/08_433337.jpg,our chic comfortable pants a convenient pair that can be dressed up or down made of a way stretch fabric that stretches to easily bend with your knees for a stress free fit easy care minimizes wrinkles and makes ironing easier the wool like texture makes it suitable workwear the waist stretches for improved comfort recreated the details of authentic wool pants such as the buttons and design on the inside of the waist center pleats that retain their shape for a sharp look,MEN,"67% Polyester, 29% Rayon, 4% Spandex",59.9,UNIQLO,Color: COL08 DARK GRAY,our chic comfortable pants a convenient pair that can be dressed up or down made of a way stretch fabric that stretches to easily bend with your knees for a stress free fit easy care minimizes wrinkles and makes ironing easier the wool like texture makes it suitable workwear the waist stretches for improved comfort recreated the details of authentic wool pants such as the buttons and design on the inside of the waist center pleats that retain their shape for a sharp look
64,64,MEN EZY Jogger Pants (Ultra Stretch),https://d15udtvdbbfasl.cloudfront.net/catalog/product/large_image/69_423065.jpg,it looks neat and clean high performance fabric and an uneven hem for a sporty look groundbreaking dry ex material quickly dries sweat and moisture refined fabrics and a clean silhouette make this shirt a good choice the hem is narrow so it is roomy but it is also comfortable and is great for an active lifestyle it is finished with elastic around the waist and snap buttons at the front for a laid back look and flat knit comfort,MEN,100% Polyester,29.9,UNIQLO,Color: COL69 NAVY,it looks neat and clean high performance fabric and an uneven hem for a sporty look groundbreaking dry ex material quickly dries sweat and moisture refined fabrics and a clean silhouette make this shirt a good choice the hem is narrow so it is roomy but it is also comfortable and is great for an active lifestyle it is finished with elastic around the waist and snap buttons at the front for a laid back look and flat knit comfort
65,65,MEN Skinny Fit Chino Pants 2Way Stretch,https://d15udtvdbbfasl.cloudfront.net/catalog/product/large_image/26_428908.jpg,excellent stretch for easy movement the skinny silhouette will make your feet look sharp way stretch cotton twill stretches vertically and horizontally this item provides stress free comfort and is easy to wear even when you bend your knees the tapered begins high at the knee positions make your legs look long and slim belt and waist darts ensure a secure fit the bio wash processing makes it softer and feels more soft to the touch,MEN,"95% Cotton, 5% Spandex",29.9,UNIQLO,Color: COL26 ORANGE,excellent stretch for easy movement the skinny silhouette will make your feet look sharp way stretch cotton twill stretches vertically and horizontally this item provides stress free comfort and is easy to wear even when you bend your knees the tapered begins high at the knee positions make your legs look long and slim belt and waist darts ensure a secure fit the bio wash processing makes it softer and feels more soft to the touch
66,66,MEN Vintage Regular Fit Chino Pants,https://d15udtvdbbfasl.cloudfront.net/catalog/product/large_image/31_433335.jpg,a traditional pair that has been carefully made from the different threads used to the details on the reverse side made from cotton this item is perfect for a comfortable and relaxed style we were very specific about the details of this design including the width of the belt loops the front opening the buttons the front coin pockets and the wide double stitch pattern double stitched on the outside for better durability and chain stitched on the reverse side so the lines flow and curve with your body movements bar tacked the portions where the fabric overlaps such as the lining of the belt loop and pocket openings,MEN,100% Cotton,49.9,UNIQLO,Color: COL31 BEIGE,a traditional pair that has been carefully made from the different threads used to the details on the reverse side made from cotton this item is perfect for a comfortable and relaxed style we were very specific about the details of this design including the width of the belt loops the front opening the buttons the front coin pockets and the wide double stitch pattern double stitched on the outside for better durability and chain stitched on the reverse side so the lines flow and curve with your body movements bar tacked the portions where the fabric overlaps such as the lining of the belt loop and pocket openings
67,67,MEN Vintage Regular Fit Chino Pants,https://d15udtvdbbfasl.cloudfront.net/catalog/product/large_image/56_422371.jpg,a relaxed cut in a traditional chino allows you to enjoy both traditional and seasonal style made from proprietary cotton webbing developed by brand the textile is firm and resilient but we were able to achieve a soft feel by making the wefts that touch the skin very thin a seasonal style with a relaxed regular fit we were very specific about the details of this design including the width of the belt loops the front opening the natural nut buttons the front coin pockets and the wide double stitch design,MEN,100% Cotton,39.9,UNIQLO,Color: COL56 OLIVE,a relaxed cut in a traditional chino allows you to enjoy both traditional and seasonal style made from proprietary cotton webbing developed by brand the textile is firm and resilient but we were able to achieve a soft feel by making the wefts that touch the skin very thin a seasonal style with a relaxed regular fit we were very specific about the details of this design including the width of the belt loops the front opening the natural nut buttons the front coin pockets and the wide double stitch design
69,69,MEN Ultra Stretch Active Jogger Pants,https://d15udtvdbbfasl.cloudfront.net/catalog/product/large_image/03_433054.jpg,a high performance item approved by athletes stretchy and quick drying and made with convenient details made with ultra stretch fabric comes with dry ex technology the right pocket has a hidden zipper and it has been designed to keep items like keys and cards from falling out,MEN,100% Polyester,29.9,UNIQLO,Color: COL03 GRAY,a high performance item approved by athletes stretchy and quick drying and made with convenient details made with ultra stretch fabric comes with dry ex technology the right pocket has a hidden zipper and it has been designed to keep items like keys and cards from falling out
71,71,MEN Jogger Pants,https://d15udtvdbbfasl.cloudfront.net/catalog/product/large_image/07_434845.jpg,sleek around the feet for a sporty look incredibly comfortable and easy to move around in stretch cotton twill with a casual texture a slim fit tapered cut that is sleek and perfect for jogger pants an easy elastic waist for comfort,MEN,"98% Cotton, 2% Spandex",49.9,UNIQLO,Color: COL07 GRAY,sleek around the feet for a sporty look incredibly comfortable and easy to move around in stretch cotton twill with a casual texture a slim fit tapered cut that is sleek and perfect for jogger pants an easy elastic waist for comfort
72,72,MEN Cargo Jogger Pants,https://d15udtvdbbfasl.cloudfront.net/catalog/product/large_image/09_438643.jpg,sleek around the feet for a sporty look carefully designed to have the distinct casual feel of cargo pants made of slub cotton fabric with a casual look used special processing to get an even more casual feel the traditional military pants with a modern twist a slim fit tapered cut that is sleek and perfect for jogger pants an easy elastic waist for comfort,MEN,"98% Cotton, 2% Spandex",49.9,UNIQLO,Color: COL09 BLACK,sleek around the feet for a sporty look carefully designed to have the distinct casual feel of cargo pants made of slub cotton fabric with a casual look used special processing to get an even more casual feel the traditional military pants with a modern twist a slim fit tapered cut that is sleek and perfect for jogger pants an easy elastic waist for comfort
73,73,MEN Slim Fit Chino Pants,https://d15udtvdbbfasl.cloudfront.net/catalog/product/large_image/01_433334.jpg,sleek texture and cut a convenient pair that can dresses up or down workwear inspired pattern so you can wear them with a shirt tucked in stretch at the waist for added comfort a clean look featuring double besom back pockets and subtle stitching for the belt loops and side seams,MEN,"[07Gray] 60% Cotton, 37% Polyester, 3% Spandex [Other Color] 97% Cotton, 3% Spandex",49.9,UNIQLO,Color: COL01 OFF WHITE,sleek texture and cut a convenient pair that can dresses up or down workwear inspired pattern so you can wear them with a shirt tucked in stretch at the waist for added comfort a clean look featuring double besom back pockets and subtle stitching for the belt loops and side seams
74,74,MEN Jersey Relax Ankle Pants (Wash),https://d15udtvdbbfasl.cloudfront.net/catalog/product/large_image/08_431595.jpg,chino like pants that look casual great for wearing around the house or out on the town twill material has been pre washed to produce moderate discoloration for a casual look this item features darts for a contoured relaxed fit around the waist and an ankle length that tapers towards the hem uses two thicker threads for the sides and pockets in order to give them a workwear like feel increased durability with added stitching to the pocket opening features two square back pockets the waist is flat with a folded belt for a clean cut look the tip of the drawstring has been folded like a hook so it won t fall out even in the wash a design that can be worn outdoors and goes well with relaxed styles,MEN,"96% Cotton, 4% Spandex",29.9,UNIQLO,Color: COL08 DARK GRAY,chino like pants that look casual great for wearing around the house or out on the town twill material has been pre washed to produce moderate discoloration for a casual look this item features darts for a contoured relaxed fit around the waist and an ankle length that tapers towards the hem uses two thicker threads for the sides and pockets in order to give them a workwear like feel increased durability with added stitching to the pocket opening features two square back pockets the waist is flat with a folded belt for a clean cut look the tip of the drawstring has been folded like a hook so it won t fall out even in the wash a design that can be worn outdoors and goes well with relaxed styles
75,75,MEN Jersey Relaxed Ankle Pants,https://d15udtvdbbfasl.cloudfront.net/catalog/product/large_image/09_434930.jpg,more comfortable than ever before in the same relaxed fit and a more jean like design updated to a jersey fabric with a more denim like feel super soft and comfortable ankle length tapered cut will not hold you back,MEN,"59% Cotton, 36% Polyester, 5% Spandex",29.9,UNIQLO,Color: COL09 BLACK,more comfortable than ever before in the same relaxed fit and a more jean like design updated to a jersey fabric with a more denim like feel super soft and comfortable ankle length tapered cut will not hold you back
77,77,MEN Nylon Utility Geared Pants (3D Cut),https://d15udtvdbbfasl.cloudfront.net/catalog/product/large_image/08_434843.jpg,high performance pants that are perfect for any temperature a convenient pair for everyday use or for sportswear made with stretch fabric a cut that is loose fitting around the waist and tapered toward the hem new 3d cut that is incredibly easy to move around in a one touch belt buckle that securely holds up the waist but can be easily adjusted or undone added convenient side pockets on the left side in response to customer feedback we have made a long length version of the nylon active shorts utility design that matches any scene,MEN,"Body: 96% Nylon, 4% Spandex/ Belts: 100% Polyester",49.9,UNIQLO,Color: COL08 DARK GRAY,high performance pants that are perfect for any temperature a convenient pair for everyday use or for sportswear made with stretch fabric a cut that is loose fitting around the waist and tapered toward the hem new 3d cut that is incredibly easy to move around in a one touch belt buckle that securely holds up the waist but can be easily adjusted or undone added convenient side pockets on the left side in response to customer feedback we have made a long length version of the nylon active shorts utility design that matches any scene
78,78,MEN Ultra Stretch Active Jogger Pants,https://d15udtvdbbfasl.cloudfront.net/catalog/product/large_image/03_422967.jpg,great functionality and streamlined silhouette perfect for playing sports or just lounging around with quick drying dry technology ultra stretch material that is lightweight and stretches horizontally and vertically the updates for this season include a pattern around the crotch area for a more comfortable feel we have re worked the fit of the waist in response to customer feedback it is a casual look with a tapered silhouette that is great for any occasion the material itself was adjusted to create a better color,MEN,100% Polyester,29.9,UNIQLO,Color: COL03 GRAY,great functionality and streamlined silhouette perfect for playing sports or just lounging around with quick drying dry technology ultra stretch material that is lightweight and stretches horizontally and vertically the updates for this season include a pattern around the crotch area for a more comfortable feel we have re worked the fit of the waist in response to customer feedback it is a casual look with a tapered silhouette that is great for any occasion the material itself was adjusted to create a better color
79,79,MEN Ultra Stretch Dry Sweat Pants,https://d15udtvdbbfasl.cloudfront.net/catalog/product/large_image/04_429184.jpg,surprisingly light and stretchy for stress free comfort this piece works well for any occasion twice the stretch of conventional dry stretch material but lighter the ultra stretch fabric has about double the stretch ratio vertically and horizontally making it comfortable enough you could forget that you are wearing it the fabric has many air layers so that it has a high degree of thermal insulation and excellent heat retention high level quick drying functionality means it dries almost instantly smooth texture maintained by anti pilling functionality three dimensional design that naturally traces leg lines added details allow for easy movement such as a zip pocket that is easy to open and close thanks to a zipper tag due to the characteristics of this product s material wrinkles may occur after folding reduce any wrinkling by lightly pressing it with a steam iron along with a pressing cloth,MEN,"93% Polyester, 7% Spandex",39.9,UNIQLO,Color: COL04 GRAY,surprisingly light and stretchy for stress free comfort this piece works well for any occasion twice the stretch of conventional dry stretch material but lighter the ultra stretch fabric has about double the stretch ratio vertically and horizontally making it comfortable enough you could forget that you are wearing it the fabric has many air layers so that it has a high degree of thermal insulation and excellent heat retention high level quick drying functionality means it dries almost instantly smooth texture maintained by anti pilling functionality three dimensional design that naturally traces leg lines added details allow for easy movement such as a zip pocket that is easy to open and close thanks to a zipper tag due to the characteristics of this product s material wrinkles may occur after folding reduce any wrinkling by lightly pressing it with a steam iron along with a pressing cloth
80,80,MEN Uniqlo U Regular Fit Work Pants,https://d15udtvdbbfasl.cloudfront.net/catalog/product/large_image/09_437409.jpg,made with a durable material with a sharp look carefully designed to last long the brand u collection is the realization of a dedicated and skilled team of international designers based at our paris research and development center led by artistic director christophe lemaire made with kurabos cotton polyester twill we blended cotton and polyester for enhanced durability and so the center crease stays crisp elegant high rise straight cut versatile design with trouser hooks wide slant pockets on the side and patch pockets on the back blended fabric and thoughtful design increase its durability,MEN,"70% Cotton, 30% Polyester",59.9,UNIQLO,Color: COL09 BLACK,made with a durable material with a sharp look carefully designed to last long the brand u collection is the realization of a dedicated and skilled team of international designers based at our paris research and development center led by artistic director christophe lemaire made with kurabos cotton polyester twill we blended cotton and polyester for enhanced durability and so the center crease stays crisp elegant high rise straight cut versatile design with trouser hooks wide slant pockets on the side and patch pockets on the back blended fabric and thoughtful design increase its durability
82,82,MEN Sweat Pants,https://d15udtvdbbfasl.cloudfront.net/catalog/product/large_image/03_429162.jpg,a simple silhouette that can also be worn casually the fabric s ingenuity makes it easy to care for these sweatpants can be used in any situation whether you re at home or out and about the neat looking tapered silhouette has been preserved making it more spacious and comfortable to wear around the waist based on vintage sweats this item uses thick threads for additional casualness and durability,MEN,"Body: 90% Cotton, 10% Polyester/ Rib: 86% Cotton, 14% Polyester",29.9,UNIQLO,Color: COL03 GRAY,a simple silhouette that can also be worn casually the fabric s ingenuity makes it easy to care for these sweatpants can be used in any situation whether you re at home or out and about the neat looking tapered silhouette has been preserved making it more spacious and comfortable to wear around the waist based on vintage sweats this item uses thick threads for additional casualness and durability
