,img_id,title,img_url,description,sex,material,price,brand,colour,Description
571,571,WOMEN Washer Satin Skirt Pants,https://d15udtvdbbfasl.cloudfront.net/catalog/product/large_image/09_436612.jpg,a contoured silhouette with an airy stylish look designed with a slit so they are easy to walk in thin and light fabric with an elegant sheen can be worn for both formal and casual occasions does not stick to the skin so they feel cool and fresh created a textured contoured surface through a special washing process designed with vertical pleats for a sleek look the legs peek out from the side slits when walking adding a light and breezy look like a skirt supremely comfortable thanks to the wide cut and elastic waist you can wash them easily at home by hand and the pleats stay intact even after washing,WOMEN,100% Polyester,39.9,UNIQLO,Color: COL09 BLACK,a contoured silhouette with an airy stylish look designed with a slit so they are easy to walk in thin and light fabric with an elegant sheen can be worn for both formal and casual occasions does not stick to the skin so they feel cool and fresh created a textured contoured surface through a special washing process designed with vertical pleats for a sleek look the legs peek out from the side slits when walking adding a light and breezy look like a skirt supremely comfortable thanks to the wide cut and elastic waist you can wash them easily at home by hand and the pleats stay intact even after washing
572,572,WOMEN Denim Jersey Pants,https://d15udtvdbbfasl.cloudfront.net/catalog/product/large_image/01_435871.jpg,now with pockets for convenience distinct denim like colours knit fabric is soft and comfortable simple design and fit with pockets indigo dyed yarn has a rich colour,WOMEN,"96% Cotton, 4% Spandex",39.9,UNIQLO,Color: COL01 OFF WHITE,now with pockets for convenience distinct denim like colours knit fabric is soft and comfortable simple design and fit with pockets indigo dyed yarn has a rich colour
573,573,WOMEN Drape Jogger Pants (Palm Tree),https://d15udtvdbbfasl.cloudfront.net/catalog/product/large_image/09_428445.jpg,the smooth light feel of rayon comfortable jogger pants with a sleek silhouette light silky rayon with an elegant drape,WOMEN,100% Rayon,19.9,UNIQLO,Color: COL09 BLACK,the smooth light feel of rayon comfortable jogger pants with a sleek silhouette light silky rayon with an elegant drape
574,574,WOMEN Printed Drape Jogger Pants,https://d15udtvdbbfasl.cloudfront.net/catalog/product/large_image/61_434523.jpg,featuring draped fabric and charming colors and patterns easy waist pants perfect for inside and outside of the house viscose rayon fabric that is incredibly soft smooth and comfortable changed to a slightly shorter inseam made the elastic waistband more narrow for a design that can be used as one mile wear small floral print that incorporates delicate but vibrant colors we recommend wearing them as one mile wear as well as loungewear,WOMEN,100% Rayon,19.9,UNIQLO,Color: COL61 Blue,featuring draped fabric and charming colors and patterns easy waist pants perfect for inside and outside of the house viscose rayon fabric that is incredibly soft smooth and comfortable changed to a slightly shorter inseam made the elastic waistband more narrow for a design that can be used as one mile wear small floral print that incorporates delicate but vibrant colors we recommend wearing them as one mile wear as well as loungewear
575,575,WOMEN Drape Straight Pants (Leaf),https://d15udtvdbbfasl.cloudfront.net/catalog/product/large_image/35_428448.jpg,pants that feel fresh with a comfortable texture and relaxed silhouette a pair that is perfect for relaxing rayon material that is very lightweight and smooth with a nice drape a collection featuring graphics with a natural and personal touch the print is a relaxed pattern with a flower motif straight silhouette that can be worn loosely and comfortably,WOMEN,100% Rayon,19.9,UNIQLO,Color: COL35 BROWN,pants that feel fresh with a comfortable texture and relaxed silhouette a pair that is perfect for relaxing rayon material that is very lightweight and smooth with a nice drape a collection featuring graphics with a natural and personal touch the print is a relaxed pattern with a flower motif straight silhouette that can be worn loosely and comfortably
576,576,WOMEN Sweat Pants,https://d15udtvdbbfasl.cloudfront.net/catalog/product/large_image/01_428335.jpg,stylishly sleek yet perfectly casual now in an even more comfortable material cotton polyester blend dries quickly after washing and retains its shape sleek slim fit with a tapered cut below the knees drawstring at the waist for easy size adjustment the ribbed hem creates a sleek look at the ankles a great option as lounge pants or for wearing out and about,WOMEN,"Body: 86% Cotton, 14% Polyester/ Rib: 82% Cotton, 18% Polyester",29.9,UNIQLO,Color: COL01 OFF WHITE,stylishly sleek yet perfectly casual now in an even more comfortable material cotton polyester blend dries quickly after washing and retains its shape sleek slim fit with a tapered cut below the knees drawstring at the waist for easy size adjustment the ribbed hem creates a sleek look at the ankles a great option as lounge pants or for wearing out and about
577,577,WOMEN Pile Lined Sweat Pants,https://d15udtvdbbfasl.cloudfront.net/catalog/product/large_image/01_428341.jpg,the boa lining is soft and warm but the silhouette and design are sleek making this item easy to wear outside this boa sweat material is surprisingly warm and uses a brushed lining fabric to reduce dullness this item is made from one piece of fabric so it is not stiff and has a sleek silhouette that makes it a great outerwear piece we refined the shape by streamlining the waist the long length and ribbed hems keep your feet warm,WOMEN,"Body: 72% Polyester, 28% Cotton/ Rib: 95% Cotton, 5% Spandex",14.9,UNIQLO,Color: COL01 OFF WHITE,the boa lining is soft and warm but the silhouette and design are sleek making this item easy to wear outside this boa sweat material is surprisingly warm and uses a brushed lining fabric to reduce dullness this item is made from one piece of fabric so it is not stiff and has a sleek silhouette that makes it a great outerwear piece we refined the shape by streamlining the waist the long length and ribbed hems keep your feet warm
578,578,WOMEN Printed Drape Jogger Pants,https://d15udtvdbbfasl.cloudfront.net/catalog/product/large_image/01_434528.jpg,drape fabric with charming colors and patterns easy waist pants perfect for inside and outside of the house rayon cut for a slightly shorter inseam made the elastic waistband more narrow for a design to use as one mile wear a simple pattern that combines a floral print with small geometric shapes we recommend wearing them as one mile wear as well as loungewear,WOMEN,100% Rayon,19.9,UNIQLO,Color: COL01 OFF WHITE,drape fabric with charming colors and patterns easy waist pants perfect for inside and outside of the house rayon cut for a slightly shorter inseam made the elastic waistband more narrow for a design to use as one mile wear a simple pattern that combines a floral print with small geometric shapes we recommend wearing them as one mile wear as well as loungewear
579,579,WOMEN Printed Drape Straight Pants,https://d15udtvdbbfasl.cloudfront.net/catalog/product/large_image/68_437872.jpg,featuring draped fabric and charming colors and patterns easy waist pants perfect for inside and outside of the house viscose rayon fabric that is incredibly soft smooth and comfortable updated to be more narrow around the thighs and a slightly shorter inseam for a sleeker look made the elastic waistband more narrow for a design that can be used as one mile wear charming pattern illustrating small flowers and stems we recommend wearing them as one mile wear as well as loungewear,WOMEN,100% Rayon,19.9,UNIQLO,Color: COL68 Blue,featuring draped fabric and charming colors and patterns easy waist pants perfect for inside and outside of the house viscose rayon fabric that is incredibly soft smooth and comfortable updated to be more narrow around the thighs and a slightly shorter inseam for a sleeker look made the elastic waistband more narrow for a design that can be used as one mile wear charming pattern illustrating small flowers and stems we recommend wearing them as one mile wear as well as loungewear
580,580,WOMEN Satin Drape Straight Pants,https://d15udtvdbbfasl.cloudfront.net/catalog/product/large_image/05_434522.jpg,lounge pants with a classy feel a lustrous and elegant design to wear at home or out glossy satin fabric that styles fashionably designed with an elastic waistband for ease of movement and a tassel drawstring for a stylish touch,WOMEN,100% Rayon,19.9,UNIQLO,Color: COL05 GRAY,lounge pants with a classy feel a lustrous and elegant design to wear at home or out glossy satin fabric that styles fashionably designed with an elastic waistband for ease of movement and a tassel drawstring for a stylish touch
581,581,WOMEN Printed Drape Straight Pants,https://d15udtvdbbfasl.cloudfront.net/catalog/product/large_image/42_434527.jpg,featuring draped fabric and charming colors and patterns easy waist pants perfect for inside and outside of the house viscose rayon fabric that is incredibly soft smooth and comfortable updated to be more narrow around the thighs and a slightly shorter inseam for a sleeker look made the elastic waistband more narrow for a design that can be used as one mile wear small floral print that incorporates delicate but vibrant colors we recommend wearing them as one mile wear as well as loungewear,WOMEN,100% Rayon,19.9,UNIQLO,Color: COL42 YELLOW,featuring draped fabric and charming colors and patterns easy waist pants perfect for inside and outside of the house viscose rayon fabric that is incredibly soft smooth and comfortable updated to be more narrow around the thighs and a slightly shorter inseam for a sleeker look made the elastic waistband more narrow for a design that can be used as one mile wear small floral print that incorporates delicate but vibrant colors we recommend wearing them as one mile wear as well as loungewear
582,582,WOMEN Linen Cotton Tapered Pants,https://d15udtvdbbfasl.cloudfront.net/catalog/product/large_image/08_433265.jpg,stylish silhouette with a cool breezy feel casual pants with a natural look both the material and silhouette have a natural laidback feel so you can style them casually tapered cut can be paired with any kind of top sleek on trend high waist the natural color complements this material,WOMEN,"[08Dark Gray] 55% Linen, 45% Cotton [Other Colors] 50% Cotton, 50% Linen",49.9,UNIQLO,Color: COL08 DARK GRAY,stylish silhouette with a cool breezy feel casual pants with a natural look both the material and silhouette have a natural laidback feel so you can style them casually tapered cut can be paired with any kind of top sleek on trend high waist the natural color complements this material
583,583,WOMEN Extra Warm Lined Pants,https://d15udtvdbbfasl.cloudfront.net/catalog/product/large_image/08_432244.jpg,added padding to heattech for even greater warmth a sleek cut that is easy to style the outside is made of stretchy cotton like material that is easy to move around in added padding and lined with heattech fleece for incredible warmth flattering tapered cut the pockets are lined with brushed tricot material for even greater warmth the inner waistband allows you to make size adjustments the side pockets come with zippers the back pockets use concealed snap buttons for a sleek look and the waist also looks higher up constructed from a single piece of fabric for an exceptionally sleek look,WOMEN,"Shell: 90% Polyester, 10% Spandex/ Filling: 100% Polyester/ Lining: 100% Polyester",19.9,UNIQLO,Color: COL08 DARK GRAY,added padding to heattech for even greater warmth a sleek cut that is easy to style the outside is made of stretchy cotton like material that is easy to move around in added padding and lined with heattech fleece for incredible warmth flattering tapered cut the pockets are lined with brushed tricot material for even greater warmth the inner waistband allows you to make size adjustments the side pockets come with zippers the back pockets use concealed snap buttons for a sleek look and the waist also looks higher up constructed from a single piece of fabric for an exceptionally sleek look
584,584,WOMEN Chiffon Slit Skirt Pants,https://d15udtvdbbfasl.cloudfront.net/catalog/product/large_image/09_438099.jpg,double layered chiffon fabric for a light and elegant skirt made of double layered chiffon fabric with a charming drape the waist is entirely elastic and flatters the front of the stomach so it looks stylish even with a top tucked in designed with a deeper side slit so it is easier to move the legs and the hem sways as you walk an elegant design with a double layered slit to keep your skin covered up,WOMEN,Shell: 100% Polyester/ Lining: 100% Polyester,39.9,UNIQLO,Color: COL09 BLACK,double layered chiffon fabric for a light and elegant skirt made of double layered chiffon fabric with a charming drape the waist is entirely elastic and flatters the front of the stomach so it looks stylish even with a top tucked in designed with a deeper side slit so it is easier to move the legs and the hem sways as you walk an elegant design with a double layered slit to keep your skin covered up
585,585,WOMEN Linen Cotton Tapered Pants,https://d15udtvdbbfasl.cloudfront.net/catalog/product/large_image/07_436705.jpg,stylish silhouette with a cool breezy feel casual pants with a natural look cotton blended with soft linen for a crisp feel in a versatile flattering design tapered cut can be paired with any kind of top sleek and on trend high waist thin striped pattern complements the natural material,WOMEN,"55% Linen, 45% Cotton",49.9,UNIQLO,Color: COL07 GRAY,stylish silhouette with a cool breezy feel casual pants with a natural look cotton blended with soft linen for a crisp feel in a versatile flattering design tapered cut can be paired with any kind of top sleek and on trend high waist thin striped pattern complements the natural material
586,586,WOMEN Drape Straight Pants (Vine),https://d15udtvdbbfasl.cloudfront.net/catalog/product/large_image/69_427577.jpg,soft fabric and relaxed cut allow you to completely relax stylish design makes it great for wearing outside as well this draped design in rayon material is soft and light the fabric creates a relaxed silhouette that is perfect for loungewear a refined botanical motif makes it both elegant and chic they can be worn for lounging at home or for going out,WOMEN,100% Rayon,19.9,UNIQLO,Color: COL69 NAVY,soft fabric and relaxed cut allow you to completely relax stylish design makes it great for wearing outside as well this draped design in rayon material is soft and light the fabric creates a relaxed silhouette that is perfect for loungewear a refined botanical motif makes it both elegant and chic they can be worn for lounging at home or for going out
588,588,WOMEN Uniqlo U Pajama Pants,https://d15udtvdbbfasl.cloudfront.net/catalog/product/large_image/24_437052.jpg,classic pajama pants made with a cotton nylon blend fabric the brand u collection is the realization of a dedicated and skilled team of international designers based at our paris research and development center led by artistic director christophe lemaire lightweight with great breathability easy to clean and designed with deep rich colors comfy yet elegant classy and casual pants with minimalist details,WOMEN,"65% Cotton, 35% Nylon",59.9,UNIQLO,Color: COL24 ORANGE,classic pajama pants made with a cotton nylon blend fabric the brand u collection is the realization of a dedicated and skilled team of international designers based at our paris research and development center led by artistic director christophe lemaire lightweight with great breathability easy to clean and designed with deep rich colors comfy yet elegant classy and casual pants with minimalist details
589,589,WOMEN Drape Jogger Pants (Floral),https://d15udtvdbbfasl.cloudfront.net/catalog/product/large_image/70_432371.jpg,a silky smooth feel that keeps you cool and comfortable a convenient pair that you can wear inside and outside the home made with draped rayon material an improved design that can be layered or worn as one mile wear now with a more stylish design that can be worn outside the house a casual multi colour pattern,WOMEN,100% Rayon,19.9,UNIQLO,Color: COL70 LIGHT PURP,a silky smooth feel that keeps you cool and comfortable a convenient pair that you can wear inside and outside the home made with draped rayon material an improved design that can be layered or worn as one mile wear now with a more stylish design that can be worn outside the house a casual multi colour pattern
590,590,WOMEN Uniqlo U Jersey Relaxed Straight Pants,https://d15udtvdbbfasl.cloudfront.net/catalog/product/large_image/09_437060.jpg,jersey pants that combine a refined look with an easy waist for comfort the brand u collection is the realization of a dedicated and skilled team of international designers based at our paris research and development center led by artistic director christophe lemaire the straight cut has a charming leg flattering effect,WOMEN,"[09Black, 30Natural, 37Brown] 67% Cotton, 33% Polyester [32Beige] 69% Cotton, 31% Polyester",59.9,UNIQLO,Color: COL09 BLACK,jersey pants that combine a refined look with an easy waist for comfort the brand u collection is the realization of a dedicated and skilled team of international designers based at our paris research and development center led by artistic director christophe lemaire the straight cut has a charming leg flattering effect
591,591,WOMEN +J Chino Pants,https://d15udtvdbbfasl.cloudfront.net/catalog/product/large_image/08_435888.jpg,legendary designer jil sander returns to brand with her signature modernist style inspired by a sense of enlightened understatement the collection consists of exceptional pieces with versatile styling options chino pants with carefully calculated curves that flatter the legs stretchy cotton material casual pants with a distinctive curved fit,WOMEN,"96% Cotton, 4% Spandex",19.9,UNIQLO,Color: COL08 DARK GRAY,legendary designer jil sander returns to brand with her signature modernist style inspired by a sense of enlightened understatement the collection consists of exceptional pieces with versatile styling options chino pants with carefully calculated curves that flatter the legs stretchy cotton material casual pants with a distinctive curved fit
592,592,WOMEN Uniqlo U Relaxed Straight Pants,https://d15udtvdbbfasl.cloudfront.net/catalog/product/large_image/09_437064.jpg,comfortable and lightweight pants with a simple and stylish design the brand u collection is the realization of a dedicated and skilled team of international designers based at our paris research and development center led by artistic director christophe lemaire material that feels smooth and lightweight new brand u pants with an elegant minimalist design straight wide leg cut with a comfortable easy waist design flattering design and minimalist details for sophisticated comfort,WOMEN,100% Polyester,59.9,UNIQLO,Color: COL09 BLACK,comfortable and lightweight pants with a simple and stylish design the brand u collection is the realization of a dedicated and skilled team of international designers based at our paris research and development center led by artistic director christophe lemaire material that feels smooth and lightweight new brand u pants with an elegant minimalist design straight wide leg cut with a comfortable easy waist design flattering design and minimalist details for sophisticated comfort
593,593,WOMEN Drape Straight Pants (Small Flower),https://d15udtvdbbfasl.cloudfront.net/catalog/product/large_image/32_432372.jpg,a silky smooth feel that keeps you cool and comfortable a convenient pair that you can wear inside and outside the home made with draped rayon material an improved design that can be layered or worn as casual lounge wear we updated these pants to have a more stylish design that can be worn outside the house a subdued two tone floral print,WOMEN,100% Rayon,19.9,UNIQLO,Color: COL32 BEIGE,a silky smooth feel that keeps you cool and comfortable a convenient pair that you can wear inside and outside the home made with draped rayon material an improved design that can be layered or worn as casual lounge wear we updated these pants to have a more stylish design that can be worn outside the house a subdued two tone floral print
594,594,WOMEN Chiffon Pleated Skirt Pants,https://d15udtvdbbfasl.cloudfront.net/catalog/product/large_image/09_437166.jpg,versatile bottoms that wear like pants and look like a skirt washable for easy care features a skirt like design with pleats for flowy movement the new design features a longer length a smaller hem and less volume for a clean fit the pleated sheer fabric has a soft look features a new clean waistline that makes it easy to wear with a top tucked in,WOMEN,Shell: 100% Polyester/ Lining: 100% Polyester,39.9,UNIQLO,Color: COL09 BLACK,versatile bottoms that wear like pants and look like a skirt washable for easy care features a skirt like design with pleats for flowy movement the new design features a longer length a smaller hem and less volume for a clean fit the pleated sheer fabric has a soft look features a new clean waistline that makes it easy to wear with a top tucked in
595,595,WOMEN Uniqlo U Sweat Pants,https://d15udtvdbbfasl.cloudfront.net/catalog/product/large_image/09_437097.jpg,charming sweats with a trendy sleek silhouette and smooth texture the brand u collection is the realization of a dedicated and skilled team of international designers based at our paris research and development center led by artistic director christophe lemaire used non brushed french terry material streamlined cut that flatters the legs non brushed french terry material for a lightweight feel,WOMEN,100% Cotton,49.9,UNIQLO,Color: COL09 BLACK,charming sweats with a trendy sleek silhouette and smooth texture the brand u collection is the realization of a dedicated and skilled team of international designers based at our paris research and development center led by artistic director christophe lemaire used non brushed french terry material streamlined cut that flatters the legs non brushed french terry material for a lightweight feel
596,596,WOMEN Smart Satin Ankle Pants,https://d15udtvdbbfasl.cloudfront.net/catalog/product/large_image/71_437090.jpg,satin fabric is comfortable yet looks elegant and formal made with stretch material new hidden elastic waist looks great with your shirt tucked in,WOMEN,"72% Cotton, 22% Rayon, 6% Spandex",39.9,UNIQLO,Colour:COL09 BLACK,satin fabric is comfortable yet looks elegant and formal made with stretch material new hidden elastic waist looks great with your shirt tucked in
597,597,WOMEN Ultra Stretch Active Jogger Pants,https://d15udtvdbbfasl.cloudfront.net/catalog/product/large_image/03_431537.jpg,amazing stretch and quick dry features make them perfect for exercise ankle length for a clean and sleek look ultra stretch fabric that stretches in all directions to offer complete freedom of movement dry ex that quickly wicks away any sweat and moisture,WOMEN,100% Polyester,19.9,UNIQLO,Colour:COL03 GRAY,amazing stretch and quick dry features make them perfect for exercise ankle length for a clean and sleek look ultra stretch fabric that stretches in all directions to offer complete freedom of movement dry ex that quickly wicks away any sweat and moisture
598,598,WOMEN Smart Ankle Pants (2Way Stretch),https://d15udtvdbbfasl.cloudfront.net/catalog/product/large_image/01_433255.jpg,perfect for work or lounging at home versatile and comfy pants that can be worn in many different ways made with two way material that stretches vertically and horizontally will not wrinkle even after washing the center crease is made with resin processing new hidden elastic waist looks great with your shirt tucked in features a tapered fit with straight legs below the knees for easier movement the center pleats will stay crisp wash after wash perfect for dressing up or down,WOMEN,"65% Polyester, 31% Rayon, 4% Spandex",49.9,UNIQLO,Color: COL01 OFF WHITE,perfect for work or lounging at home versatile and comfy pants that can be worn in many different ways made with two way material that stretches vertically and horizontally will not wrinkle even after washing the center crease is made with resin processing new hidden elastic waist looks great with your shirt tucked in features a tapered fit with straight legs below the knees for easier movement the center pleats will stay crisp wash after wash perfect for dressing up or down
600,600,WOMEN Cotton Relax Ankle Pants,https://d15udtvdbbfasl.cloudfront.net/catalog/product/large_image/01_435830.jpg,comfortable design still looks put together elevated design to be more than just loungewear changed the drawstring to the same fabric as the pants cotton in a relaxed tapered cut perfect for around the house and your neighborhood,WOMEN,100% Cotton,19.9,UNIQLO,Color: COL01 OFF WHITE,comfortable design still looks put together elevated design to be more than just loungewear changed the drawstring to the same fabric as the pants cotton in a relaxed tapered cut perfect for around the house and your neighborhood
