,img_id,title,img_url,description,sex,material,price,brand,colour,Description
111,111,MEN AIRism Crew Neck T-Shirt (Short Sleeve),https://d15udtvdbbfasl.cloudfront.net/catalog/product/large_image/02_437564.jpg,innerwear that keeps you dry and comfortable with dry cool touch odor controlling and deodorizing comfort features stretch fabric is smooth and comfortable against the skin silky smooth texture detachable collar that is perfect for layering made in a color that is easy to wear as an inner layer,MEN,"89% Polyester, 11% Spandex",14.9,UNIQLO,Color: COL02 LIGHT GRAY,innerwear that keeps you dry and comfortable with dry cool touch odor controlling and deodorizing comfort features stretch fabric is smooth and comfortable against the skin silky smooth texture detachable collar that is perfect for layering made in a color that is easy to wear as an inner layer
113,113,MEN AIRism V Neck T-Shirt (Short Sleeve),https://d15udtvdbbfasl.cloudfront.net/catalog/product/large_image/00_434163.jpg,stay fresh comfort v neck stays hidden under your shirt fully loaded with dry technology cool touch odor control and deodorizing comfort features stretch fabric is smooth and comfortable against the skin deep v neck stays hidden even under an unbuttoned shirt collar available in versatile basic colors,MEN,"88% Polyester, 12% Spandex",14.9,UNIQLO,Color: COL00 WHITE,stay fresh comfort v neck stays hidden under your shirt fully loaded with dry technology cool touch odor control and deodorizing comfort features stretch fabric is smooth and comfortable against the skin deep v neck stays hidden even under an unbuttoned shirt collar available in versatile basic colors
114,114,MEN AIRism V Neck T-Shirt (Short Sleeve),https://d15udtvdbbfasl.cloudfront.net/catalog/product/large_image/00_423523.jpg,undershirt that keeps you dry and comfortable with quick dry cool touch anti microbial odor controlling and odor eliminating technologies stretch material feels very smooth like silk made with full dull yarn that reduces luster and make the material non see through low v neck stays invisible under a shirt,MEN,"88% Polyester, 12% Spandex",14.9,UNIQLO,Color: COL00 WHITE,undershirt that keeps you dry and comfortable with quick dry cool touch anti microbial odor controlling and odor eliminating technologies stretch material feels very smooth like silk made with full dull yarn that reduces luster and make the material non see through low v neck stays invisible under a shirt
115,115,MEN Dry V Neck Short Sleeve Colour T-Shirt,https://d15udtvdbbfasl.cloudfront.net/catalog/product/large_image/00_433026.jpg,can be worn by itself or as innerwear thanks to its neckline and overall fit,MEN,"66% Cotton, 34% Polyester",7.9,UNIQLO,Color: COL00 WHITE,can be worn by itself or as innerwear thanks to its neckline and overall fit
117,117,MEN AIRism Crew Neck T-Shirt (Short Sleeve),https://d15udtvdbbfasl.cloudfront.net/catalog/product/large_image/00_423524.jpg,undershirt that keeps you dry and comfortable with quick dry cool touch anti microbial odor controlling and odor eliminating technologies stretch material feels very smooth like silk collar is added to create a clean neck line,MEN,"88% Polyester, 12% Spandex",9.9,UNIQLO,Color: COL00 WHITE,undershirt that keeps you dry and comfortable with quick dry cool touch anti microbial odor controlling and odor eliminating technologies stretch material feels very smooth like silk collar is added to create a clean neck line
118,118,MEN AIRism Cotton Tank Top,https://d15udtvdbbfasl.cloudfront.net/catalog/product/large_image/00_434168.jpg,enjoy the look of cotton and the feel of airism this tank top is also perfect on its own made of smooth airism fabric with dry technology with stretch moisture wicking cool touch odor controlling features made with cotton on the outside and airism on the inside this tank top is carefully designed such as the measurements and width of the binder so that it s perfect to wear on its own,MEN,"71% Cotton, 25% Polyester, 4% Spandex",14.9,UNIQLO,Color: COL00 WHITE,enjoy the look of cotton and the feel of airism this tank top is also perfect on its own made of smooth airism fabric with dry technology with stretch moisture wicking cool touch odor controlling features made with cotton on the outside and airism on the inside this tank top is carefully designed such as the measurements and width of the binder so that it s perfect to wear on its own
119,119,MEN AIRism Cotton Tank Top,https://d15udtvdbbfasl.cloudfront.net/catalog/product/large_image/00_426289.jpg,single layer with cotton that looks cut and sewn on the front surface and a hybrid of comfortable airism on the back surface fully loaded with comfortable features such as dry technology cool touch moisture wicking anti microbial anti odor and more smooth texture with stretch that feels great on the skin the surface is cotton so it has a cut and sewn feeling that can be worn comfortably as a single layer and it is set to the dimensions and thickness of the binder,MEN,"71% Cotton, 25% Polyester, 4% Spandex",14.9,UNIQLO,Color: COL00 WHITE,single layer with cotton that looks cut and sewn on the front surface and a hybrid of comfortable airism on the back surface fully loaded with comfortable features such as dry technology cool touch moisture wicking anti microbial anti odor and more smooth texture with stretch that feels great on the skin the surface is cotton so it has a cut and sewn feeling that can be worn comfortably as a single layer and it is set to the dimensions and thickness of the binder
529,529,WOMEN Tucked Shorts (Brushed),https://d15udtvdbbfasl.cloudfront.net/catalog/product/large_image/01_431639.jpg,the flared cut creates a beautiful outline the wool like fabric provides a sleek look brushed rayon blended fabric feels and looks like wool exceptional stretch for easy movement provide a beautiful silhouette with one tuck and a little flare elastic waist for comfort,WOMEN,"69% Polyester, 29% Rayon, 2% Spandex",29.9,UNIQLO,Color: COL01 OFF WHITE,the flared cut creates a beautiful outline the wool like fabric provides a sleek look brushed rayon blended fabric feels and looks like wool exceptional stretch for easy movement provide a beautiful silhouette with one tuck and a little flare elastic waist for comfort
530,530,WOMEN Mid Rise Denim Shorts,https://d15udtvdbbfasl.cloudfront.net/catalog/product/large_image/65_426442.jpg,gave them a classic denim look while adding comfort simple and easy to style made with comfortable denim that is stretchy while also having an authentic vintage texture simple denim that is mid rise with a relaxed fit making them easy for anyone to wear,WOMEN,"[67Blue, 65Blue, 63Blue] 99% Cotton, 1% Spandex [00White, 03Gray, 32Beige] 98% Cotton, 2% Spandex",19.9,UNIQLO,Color: COL65 Blue,gave them a classic denim look while adding comfort simple and easy to style made with comfortable denim that is stretchy while also having an authentic vintage texture simple denim that is mid rise with a relaxed fit making them easy for anyone to wear
531,531,WOMEN Denim Jersey Shorts,https://d15udtvdbbfasl.cloudfront.net/catalog/product/large_image/68_435870.jpg,new design with a smarter fit shorter length keeps you cool new design for slimmer waistline,WOMEN,"96% Cotton, 4% Spandex",29.9,UNIQLO,Colour:COL09 BLACK,new design with a smarter fit shorter length keeps you cool new design for slimmer waistline
532,532,WOMEN Drape Belted Shorts,https://d15udtvdbbfasl.cloudfront.net/catalog/product/large_image/21_436565.jpg,these cropped pants are easy to coordinate with your wardrobe explore styling options with the belt elegant draped fabric is soft and smooth belt accentuates your waist high waist and flared cut elongates the look of your legs versatile style with an elegant accent,WOMEN,100% Polyester,29.9,UNIQLO,Colour:COL09 BLACK,these cropped pants are easy to coordinate with your wardrobe explore styling options with the belt elegant draped fabric is soft and smooth belt accentuates your waist high waist and flared cut elongates the look of your legs versatile style with an elegant accent
533,533,WOMEN Ultra Stretch Active Airy Shorts,https://d15udtvdbbfasl.cloudfront.net/catalog/product/large_image/56_433740.jpg,designed for comfort and with outstanding functionality the slightly longer length makes the shorts easier to wear ultra stretch material with dry ex technology in addition to the elasticity and quick drying properties breathability has also been improved a length that is easy to style even for everyday breathability has been improved times the length has been adjusted to be slightly longer for easier wear,WOMEN,100% Polyester,29.9,UNIQLO,Colour:COL09 BLACK,designed for comfort and with outstanding functionality the slightly longer length makes the shorts easier to wear ultra stretch material with dry ex technology in addition to the elasticity and quick drying properties breathability has also been improved a length that is easy to style even for everyday breathability has been improved times the length has been adjusted to be slightly longer for easier wear
534,534,WOMEN Satin Shorts,https://d15udtvdbbfasl.cloudfront.net/catalog/product/large_image/09_425548.jpg,features an elegant texture and nice sheen so you can enjoy a dressy style with these shorts elastic waist so they can be worn with ease the glossy appearance that is unique to satin makes these look more expensive than they are,WOMEN,"97% Cotton, 3% Spandex",19.9,UNIQLO,Color: COL09 BLACK,features an elegant texture and nice sheen so you can enjoy a dressy style with these shorts elastic waist so they can be worn with ease the glossy appearance that is unique to satin makes these look more expensive than they are
535,535,WOMEN Uniqlo U Denim Shorts,https://d15udtvdbbfasl.cloudfront.net/catalog/product/large_image/00_437056.jpg,denim shorts with authentic details comfortable high waisted design the brand u collection is the realization of a dedicated and skilled team of international designers based at our paris research and development center led by artistic director christophe lemaire oz cotton denim that is durable and lightweight new shorts with authentic denim details high waisted design with comfortable and casual proportions,WOMEN,100% Cotton,49.9,UNIQLO,Color: COL00 WHITE,denim shorts with authentic details comfortable high waisted design the brand u collection is the realization of a dedicated and skilled team of international designers based at our paris research and development center led by artistic director christophe lemaire oz cotton denim that is durable and lightweight new shorts with authentic denim details high waisted design with comfortable and casual proportions
536,536,WOMEN Uniqlo U Jersey Bermuda Shorts,https://d15udtvdbbfasl.cloudfront.net/catalog/product/large_image/32_437058.jpg,comfortable and stylish shorts that are sporty casual and elegant the brand u collection is the realization of a dedicated and skilled team of international designers based at our paris research and development center led by artistic director christophe lemaire cotton polyester jersey material with a smooth and soft feel bermuda shorts made of jersey material inspired by athletic shorts a classic and versatile design elastic waist inspired by vintage slip skirts comfortable shorts designed with some volume for a beautiful skirt like flow specially balanced design for a style that is casual sporty and elegant,WOMEN,"50% Cotton, 50% Polyester",59.9,UNIQLO,Colour:COL09 BLACK,comfortable and stylish shorts that are sporty casual and elegant the brand u collection is the realization of a dedicated and skilled team of international designers based at our paris research and development center led by artistic director christophe lemaire cotton polyester jersey material with a smooth and soft feel bermuda shorts made of jersey material inspired by athletic shorts a classic and versatile design elastic waist inspired by vintage slip skirts comfortable shorts designed with some volume for a beautiful skirt like flow specially balanced design for a style that is casual sporty and elegant
537,537,WOMEN Smart Shorts,https://d15udtvdbbfasl.cloudfront.net/catalog/product/large_image/01_433270.jpg,these shorts are easy to coordinate with your wardrobe in a stylish cut fabric stretches horizontally will not wrinkle even after washing features a wool like texture open front makes it easy to put on take off and tuck in high waist elongates the look of your legs tucks flatter the stomach area,WOMEN,"[03Gray] 69% Polyester, 29% Rayon, 2% Spandex [Other Colors] 66% Polyester, 32% Rayon, 2% Spandex",29.9,UNIQLO,Color: COL01 OFF WHITE,these shorts are easy to coordinate with your wardrobe in a stylish cut fabric stretches horizontally will not wrinkle even after washing features a wool like texture open front makes it easy to put on take off and tuck in high waist elongates the look of your legs tucks flatter the stomach area
538,538,WOMEN Smart Shorts,https://d15udtvdbbfasl.cloudfront.net/catalog/product/large_image/69_439135.jpg,fabric stretches horizontally wrinkle resistant for easy care and cleaning features a wool like texture open front makes it easy to put on take off and tuck in high waist elongates the look of your legs,WOMEN,"69% Polyester, 29% Rayon, 2% Spandex",29.9,UNIQLO,Color: COL69 NAVY,fabric stretches horizontally wrinkle resistant for easy care and cleaning features a wool like texture open front makes it easy to put on take off and tuck in high waist elongates the look of your legs
540,540,WOMEN AIRism Soft Biker Shorts,https://d15udtvdbbfasl.cloudfront.net/catalog/product/large_image/07_437150.jpg,airism provides silky comfort a new biker type item that can be worn in a variety of styles uses airism with quick drying and cool touch features comfortable airism leggings in a new biker length style can be worn as streetwear or activewear for versatile looks the length has been slightly shortened and a pocket added to the waist airism with quick drying and cool touch features,WOMEN,"72% Polyester, 28% Spandex",29.9,UNIQLO,Color: COL07 GRAY,airism provides silky comfort a new biker type item that can be worn in a variety of styles uses airism with quick drying and cool touch features comfortable airism leggings in a new biker length style can be worn as streetwear or activewear for versatile looks the length has been slightly shortened and a pocket added to the waist airism with quick drying and cool touch features
541,541,WOMEN Mid Rise Denim Shorts,https://d15udtvdbbfasl.cloudfront.net/catalog/product/large_image/01_437173.jpg,stretch denim is easy to wear this item is made of denim that has a genuine vintage texture yet stretches for a comfortable wear this item has a natural look with damage treatment that incorporates the essence of vintage denim mid rise denim shorts with a relaxed fit the hems can be stretched to a slightly longer length to expose the raw edge the hems can be rolled up so it is easy to style manufactured using an environmentally conscious waterless washing method developed at the jeans innovation center reducing water use by more than,WOMEN,"99% Cotton, 1% Spandex",29.9,UNIQLO,Color: COL01 OFF WHITE,stretch denim is easy to wear this item is made of denim that has a genuine vintage texture yet stretches for a comfortable wear this item has a natural look with damage treatment that incorporates the essence of vintage denim mid rise denim shorts with a relaxed fit the hems can be stretched to a slightly longer length to expose the raw edge the hems can be rolled up so it is easy to style manufactured using an environmentally conscious waterless washing method developed at the jeans innovation center reducing water use by more than
542,542,WOMEN Belted Smart Shorts,https://d15udtvdbbfasl.cloudfront.net/catalog/product/large_image/09_425547.jpg,high rise with a belt design for an even trendier look supple material that gives them a refined feel used tetron material that you can style beautifully easy care feature makes it wrinkle resistant and easy to maintain fresh design with a belt and tuck this seasons update includes the belt of the same material so you can accentuate your waist for an on trend look even more of a high rise design for on trend styling,WOMEN,"69% Polyester, 29% Rayon, 2% Spandex",19.9,UNIQLO,Color: COL09 BLACK,high rise with a belt design for an even trendier look supple material that gives them a refined feel used tetron material that you can style beautifully easy care feature makes it wrinkle resistant and easy to maintain fresh design with a belt and tuck this seasons update includes the belt of the same material so you can accentuate your waist for an on trend look even more of a high rise design for on trend styling
543,543,WOMEN High Rise Denim Shorts,https://d15udtvdbbfasl.cloudfront.net/catalog/product/large_image/01_433253.jpg,versatile style that is easy to wear inspired by vintage denim made from cotton denim high rise slims and elongates your look the hems can be stretched to a slightly longer length to expose the raw edge the hems can be rolled up so it is easy to style manufactured using an environmentally conscious waterless washing method developed at the jeans innovation center reducing water use by more than inspired by vintage denim made from cotton denim high rise slims and elongates your look the hems can be stretched to a slightly longer length to expose the raw edge the hems can be rolled up so it is easy to style manufactured using an environmentally conscious waterless washing method developed at the jeans innovation center reducing water use by more than,WOMEN,100% Cotton,29.9,UNIQLO,Color: COL01 OFF WHITE,versatile style that is easy to wear inspired by vintage denim made from cotton denim high rise slims and elongates your look the hems can be stretched to a slightly longer length to expose the raw edge the hems can be rolled up so it is easy to style manufactured using an environmentally conscious waterless washing method developed at the jeans innovation center reducing water use by more than inspired by vintage denim made from cotton denim high rise slims and elongates your look the hems can be stretched to a slightly longer length to expose the raw edge the hems can be rolled up so it is easy to style manufactured using an environmentally conscious waterless washing method developed at the jeans innovation center reducing water use by more than
544,544,WOMEN Belted Smart Shorts,https://d15udtvdbbfasl.cloudfront.net/catalog/product/large_image/05_431016.jpg,the waist belt adds a nice touch easy to move around in despite the slender cut stretch material so they can be worn with ease featuring center pleats for a sleeker design the thin ribbon style belt adds a nice touch,WOMEN,"69% Polyester, 29% Rayon, 2% Spandex",19.9,UNIQLO,Color: COL05 GRAY,the waist belt adds a nice touch easy to move around in despite the slender cut stretch material so they can be worn with ease featuring center pleats for a sleeker design the thin ribbon style belt adds a nice touch
545,545,WOMEN Ultra Stretch Denim Shorts,https://d15udtvdbbfasl.cloudfront.net/catalog/product/large_image/01_436548.jpg,surprisingly stretchable and easy to wear cool shorts that flatter your legs made with ultra stretch denim made with dry technology cross woven yarn times thicker than usual makes the fabric more stretchy and comfortable the skinny short fit elongates the look of your legs yarns thread count manufacturing technique and thickness create a more authentic look large back pocket is positioned high to flatter stretchy mid rise with a depth that ensure you stay covered when you bend or squat pre processed finish for each color so you can choose the best one to suit your style manufactured using an environmentally conscious waterless washing method developed at the jeans innovation center reducing water use by more than,WOMEN,"88% Cotton, 9% Polyester, 3% Spandex",29.9,UNIQLO,Color: COL01 OFF WHITE,surprisingly stretchable and easy to wear cool shorts that flatter your legs made with ultra stretch denim made with dry technology cross woven yarn times thicker than usual makes the fabric more stretchy and comfortable the skinny short fit elongates the look of your legs yarns thread count manufacturing technique and thickness create a more authentic look large back pocket is positioned high to flatter stretchy mid rise with a depth that ensure you stay covered when you bend or squat pre processed finish for each color so you can choose the best one to suit your style manufactured using an environmentally conscious waterless washing method developed at the jeans innovation center reducing water use by more than
546,546,WOMEN Linen Cotton Shorts,https://d15udtvdbbfasl.cloudfront.net/catalog/product/large_image/01_433269.jpg,natural material with a comfortable feel a stylish a line silhouette pleated the front for a flattering affect blended fabric combines the cool feel of linen with the softness of cotton high waist elongates the look of your legs pleated around the stomach so it looks sleek and stylish even with a shirt tucked in a comfortable easy waist design with elastic on the back,WOMEN,"50% Cotton, 50% Linen",29.9,UNIQLO,Color: COL01 OFF WHITE,natural material with a comfortable feel a stylish a line silhouette pleated the front for a flattering affect blended fabric combines the cool feel of linen with the softness of cotton high waist elongates the look of your legs pleated around the stomach so it looks sleek and stylish even with a shirt tucked in a comfortable easy waist design with elastic on the back
547,547,WOMEN Ultra Stretch Jeans,https://d15udtvdbbfasl.cloudfront.net/catalog/product/large_image/01_433245.jpg,stretchy fabric that is comfortable and flattering jeans with the authentic look of real denim made with ultra stretch material features a tapered silhouette from the knees to the ankles to elongate legs the thread count manufacturing technique and the density of lengthwise yarns create a more authentic look larger back pockets are placed higher for a flattering look stretchy fabric for wearable comfort mid rise waist stays in place all day even while sitting manufactured using an environmentally conscious waterless washing method developed at the jeans innovation center reducing water use by more than hems and trims are added to match the colour featuring classic black that will not fade with wear and washing material,WOMEN,"[01Off White] 88% Cotton, 9% Polyester, 3% Spandex [09Black] 86% Cotton, 9% Polyester, 5% Spandex [Other Color] 89% Cotton, 7% Polyester, 4% Spandex",59.9,UNIQLO,Color: COL01 OFF WHITE,stretchy fabric that is comfortable and flattering jeans with the authentic look of real denim made with ultra stretch material features a tapered silhouette from the knees to the ankles to elongate legs the thread count manufacturing technique and the density of lengthwise yarns create a more authentic look larger back pockets are placed higher for a flattering look stretchy fabric for wearable comfort mid rise waist stays in place all day even while sitting manufactured using an environmentally conscious waterless washing method developed at the jeans innovation center reducing water use by more than hems and trims are added to match the colour featuring classic black that will not fade with wear and washing material
548,548,WOMEN Ultra Stretch Jeans (Damage),https://d15udtvdbbfasl.cloudfront.net/catalog/product/large_image/09_43655100020.jpg,stretchy fabric that is comfortable and flattering jeans with the authentic look of real denim made with ultra stretch material features a tapered silhouette from the knees to the ankles to elongate legs the thread count manufacturing technique and the density of lengthwise yarns create a more authentic look larger back pockets are placed higher for a flattering look stretchy fabric for wearable comfort mid rise waist stays in place all day even while sitting manufactured using an environmentally conscious waterless washing method developed at the jeans innovation center reducing water use by more than hems and trims are added to match the color featuring classic black that will not fade with wear and washing material,WOMEN,"[65Blue] 87% Cotton, 9% Polyester, 4% Spandex [09Black] 88% Cotton, 8% Polyester, 4% Spandex [06Gray] 88% Cotton, 9% Polyester, 3% Spandex",59.9,UNIQLO,Color: COL09 BLACK,stretchy fabric that is comfortable and flattering jeans with the authentic look of real denim made with ultra stretch material features a tapered silhouette from the knees to the ankles to elongate legs the thread count manufacturing technique and the density of lengthwise yarns create a more authentic look larger back pockets are placed higher for a flattering look stretchy fabric for wearable comfort mid rise waist stays in place all day even while sitting manufactured using an environmentally conscious waterless washing method developed at the jeans innovation center reducing water use by more than hems and trims are added to match the color featuring classic black that will not fade with wear and washing material
